{"model_choice":"M2","probabilities":{"C1":0.99,"C2":0.05,"C3":0.1},"decision":"D2","lesson":"A new tenant succeeded with an underscored header and short value, ruling out universal underscore rejection; the remaining evidence favors stale old-tenant cache state, while length-related rejection remains unresolved.","next_action":"N2"}