{"model_choice":"M2","probabilities":{"C1":0,"C2":1,"C3":0},"decision":"D2","lesson":"Retry comparison semantics are scoped by firmware scheduler configuration: v4 and v6 with compatibility_mode off use attempt < limit, while v5 and v6 with compatibility_mode on use attempt <= limit.","next_action":"N1"}