{"model_choice":"M2","probabilities":{"C1":0.99,"C2":0.01,"C3":0.01},"decision":"D2","lesson":"The improved aggregate mean masked a severe enterprise-tail regression; promotion fitness must be checked per tenant class using p99, including non-inferiority against the prior policy.","next_action":"N1"}