{"model_choice":"M2","probabilities":{"C1":0.99,"C2":0.01,"C3":0.01},"decision":"D2","lesson":"Aggregate mean improvement can conceal a tenant-specific p99 regression; global promotion requires every tenant class to meet the p99 objective and preserve enterprise non-inferiority.","next_action":"N1"}